{
  "$schema": "https://json-schema.org/draft/2020-12/schema",
  "$id": "urn:chargehand:schema:request:v1",
  "title": "chargehand run request, v1",
  "description": "What a caller sends to start a run. Intake turns it into a task-spec/v1.",
  "type": "object",
  "additionalProperties": false,
  "required": ["contract_version", "text", "context"],
  "properties": {
    "contract_version": { "const": "request/v1" },
    "text": { "type": "string", "minLength": 1, "description": "The request in natural language." },
    "context": {
      "type": "object",
      "additionalProperties": false,
      "required": ["interactive", "preset"],
      "properties": {
        "interactive": { "type": "boolean", "description": "false: never block on a question; return status needs_input instead." },
        "preset": { "type": "string", "pattern": "^[a-z][a-z0-9-]*$" },
        "budget_usd": { "type": "number", "exclusiveMinimum": 0 },
        "verify": { "type": "array", "minItems": 1, "items": { "type": "string", "minLength": 1 }, "description": "The command that verifies a change, as an argument vector, for a preset whose node writes. Absent: chargehand detects the repository's test command." },
        "approved": { "type": "boolean", "description": "true: run even if the preset's approval thresholds (risk, estimate) would stop it with needs_input." },
        "repository": {
          "type": "object",
          "additionalProperties": false,
          "required": ["path", "commit"],
          "properties": {
            "path": { "type": "string", "description": "Local checkout the worker runs in." },
            "commit": { "type": "string", "pattern": "^[0-9a-f]{7,40}$" }
          }
        }
      }
    },
    "inputs": {
      "type": "array",
      "description": "Caller-supplied facts. Claims cite them with evidence kind 'input' and locator = id.",
      "items": {
        "type": "object",
        "additionalProperties": false,
        "required": ["id", "kind", "text"],
        "properties": {
          "id": { "type": "string", "minLength": 1, "maxLength": 128 },
          "kind": { "type": "string", "minLength": 1 },
          "text": { "type": "string" },
          "source_url": { "type": "string", "format": "uri" }
        }
      }
    },
    "driven": {
      "type": "object",
      "additionalProperties": false,
      "required": ["tasks"],
      "description": "A batch of tasks run as driven sessions, one container each, ending in a draft pull request per task (ADR 0039). Needs context.repository and unique task ids; both are checked by the server, not by this schema (a schema rule that tightens a published contract would be a breaking change).",
      "properties": {
        "tasks": {
          "type": "array", "minItems": 1, "maxItems": 20,
          "items": {
            "type": "object",
            "additionalProperties": false,
            "required": ["id"],
            "anyOf": [{ "required": ["ref"] }, { "required": ["goal"] }, { "required": ["continue_from"] }],
            "properties": {
              "id": { "type": "string", "pattern": "^[a-z0-9][a-z0-9_-]{0,63}$" },
              "ref": { "type": "string", "minLength": 1, "maxLength": 128, "description": "A tracker item id, resolved through the profile's task source." },
              "goal": { "type": "string", "minLength": 1, "description": "Free text: what the change should do." },
              "title": { "type": "string", "minLength": 1, "maxLength": 200, "description": "The title of the task's pull request, one line (the server refuses a line break). Left out, the title is the goal's first sentence cut at a word to 72 characters, without its closing punctuation. The pull request body holds the whole goal either way." },
              "max_turns": { "type": "integer", "minimum": 1, "maximum": 1000, "description": "Assistant messages after which a session of this task is stopped; replaces the preset's max_turns for this task." },
              "max_minutes": { "type": "integer", "minimum": 1, "maximum": 480, "description": "Wall clock of one session of this task; replaces the preset's max_minutes for this task." },
              "size": { "enum": ["S", "M", "L"], "description": "The task's size class: the governor holds it to that class's budget (ADR 0045). Default M." },
              "budget_usd": { "type": "number", "exclusiveMinimum": 0, "description": "The task's own budget in the governor's dollar equivalent (tokens priced with the profile's price table, also on a subscription), in place of its size class's." },
              "answers": { "type": "array", "maxItems": 50, "items": { "type": "string", "minLength": 1, "maxLength": 8000 }, "description": "Answers to the questions an earlier session of the task named by continue_from asked. They go into the task's goal verbatim, after the questions (ADR 0045). Needs continue_from." },
              "acceptance": { "type": "array", "maxItems": 20, "items": { "type": "object", "additionalProperties": false, "required": ["command"], "properties": { "command": { "type": "string", "minLength": 1, "description": "A shell command (sh -c) run in the session's working tree." }, "exit_code": { "type": "integer", "description": "The exit code that passes. Default 0." }, "output": { "type": "string", "minLength": 1, "description": "Text the command's output (stdout and stderr) must contain." } } }, "description": "Machine-checkable acceptance criteria. After the session finishes, chargehand runs the repository's own checks (.chargehand/checks at the base commit) and these; a failure goes back to the session as its next turn, up to the driven preset's check_retries, and the task completes only when all pass. The result's checks artifact lists each with passed or not." },
              "depends_on": { "type": "array", "maxItems": 20, "uniqueItems": true, "items": { "type": "string", "pattern": "^[a-z0-9][a-z0-9_-]{0,63}$" }, "description": "Ids of tasks of this batch that must end completed before this one starts (ADR 0049). The task starts from their branches: one dependency stacks it on that branch and its pull request is based on it when the forge allows; several are merged into one branch before the session starts, and a merge conflict fails the task. A dependency that fails, asks a question or is not started makes this task not_started. Ids must exist and must not form a cycle; the server checks that. Cannot be combined with continue_from." },
              "continue_from": {
                "type": "object",
                "additionalProperties": false,
                "required": ["run_id", "task_id"],
                "properties": {
                  "run_id": { "type": "string", "pattern": "^[a-z0-9][a-z0-9_.-]{0,63}$", "description": "The earlier driven batch's run id; it must be in this server's run log." },
                  "task_id": { "type": "string", "pattern": "^[a-z0-9][a-z0-9_.-]{0,63}$", "description": "The task's id in that batch." }
                },
                "description": "Start this task from an earlier batch's task that ended needs_input, or stopped with its work kept: the same branch, from the kept bundle, with that task's goal, the questions it asked and the given answers in the prompt. A task that completed with its branch pushed can be continued too (a review round, ADR 0051): the branch is fetched from the remote as it is now, answers are required (the comments to address), and the pull request keeps its title and body. The task needs neither goal nor ref, and the repository commit must be the one the earlier task started at. The earlier task's output is kept for at least 7 days. Two tasks cannot continue the same one."
              }
            }
          }
        },
        "max_parallel": { "type": "integer", "minimum": 1, "maximum": 16 },
        "max_tokens_total": { "type": "integer", "minimum": 1, "description": "Input plus output tokens over the batch. Binds in both credential modes." },
        "max_usd_total": { "type": "number", "exclusiveMinimum": 0, "description": "Dollars over the batch; enforced only where the credential is priced (an API key)." },
        "draft_pr": { "const": true, "description": "Always true: pull requests are opened as drafts and never merged." },
        "plan": { "type": "boolean", "description": "Run the planning step before the batch (ADR 0049): one cheap read-only run sizes tasks that have no size, splits a large task into an ordered chain and assigns shared numbers. true forces it, false skips it; left out, the profile's driven.planning.enabled decides. A task's own size and depends_on always win. The plan is the batch result's plan artifact." }
      }
    },
    "caller_blocks": {
      "type": "array",
      "description": "Caller-owned prompt blocks. Placed in the task block and recorded in prompt_chain.",
      "items": { "$ref": "#/$defs/prompt_block" }
    }
  },
  "$defs": {
    "prompt_block": {
      "type": "object",
      "additionalProperties": false,
      "required": ["name", "version", "sha256", "text"],
      "properties": {
        "name": { "type": "string", "pattern": "^[a-z0-9][a-z0-9._/-]*$" },
        "version": { "type": "string", "pattern": "^\\d+\\.\\d+\\.\\d+(-[0-9A-Za-z.-]+)?$" },
        "sha256": { "type": "string", "pattern": "^[0-9a-f]{64}$", "description": "sha256 of the block's normalised UTF-8 bytes (LF line endings, no trailing whitespace)." },
        "text": { "type": "string" }
      }
    }
  }
}
